股票代码,股票名称,行业,细分赛道,标签,月涨幅(%),年涨幅(%),港股代码,基本面打分,短线打分,长线打分,目标价,备注
688234,天岳先进,芯片智造,碳化硅基板,碳化硅衬底龙头、技术壁垒高、产能领先、核心供应商,58.21,97.21,无,41.0,33.2,59.5,124.77,基本面41.0 | 短线33.2 | 中期59.5 | 碳化硅基板、龙头、技术壁垒高、产能领先、核心供应商、核心；缺少总市值数据，按中性处理；PE不可用或为负，估值可信度较低；毛利率19.1%，利润垫偏薄；ROE -0.8%偏低；营收同比-10.4%；利润同比-810.4% | 月涨幅分位88%；换手率2.93%；成交额18.1亿；价在MA20下方
603290,斯达半导,芯片智造,功率半导体,IGBT龙头、产能领先、国产替代,24.2,45.47,无,45.0,34.0,53.6,112.23,基本面45.0 | 短线34.0 | 中期53.6 | 龙头、产能领先、国产替代；缺少总市值数据，按中性处理；PE不可用或为负，估值可信度较低；毛利率21.1%，处于一般水平；ROE 0.4%偏低；营收同比-6.0%；利润同比-74.3% | 月涨幅分位47%；换手率5.20%；成交额15.8亿；价在MA20下方
688502,茂莱光学,芯片智造,光刻设备,光学核心、技术壁垒高,1.53,44.95,无,56.0,30.0,70.3,531.09,基本面56.0 | 短线30.0 | 中期70.3 | 光刻设备、技术壁垒高、核心；缺少总市值数据，按中性处理；PE不可用或为负，估值可信度较低；毛利率40.4%，盈利能力优秀；ROE -0.9%偏低；营收同比28.6%；利润同比-166.8% | 月涨幅分位11%；换手率3.70%；成交额10.9亿；价在MA20上方
688143,长盈通,光模块,光纤光缆,光纤光缆核心、军工配套、技术领先、国产替代,114.19,258.49,无,52.0,39.5,68.2,143.38,基本面52.0 | 短线39.5 | 中期68.2 | 光纤光缆、技术领先、国产替代、核心；缺少总市值数据，按中性处理；PE不可用或为负，估值可信度较低；毛利率46.3%，盈利能力优秀；ROE 0.4%偏低；营收同比29.5%；利润同比-28.7% | 月涨幅分位98%；换手率6.35%；成交额11.8亿；价在MA20下方
605111,新洁能,芯片智造,功率半导体,行业核心、MOSFET龙头、国产替代,77.11,153.6,无,48.0,58.9,80.1,79.28,基本面48.0 | 短线58.9 | 中期80.1 | 龙头、国产替代、核心；缺少总市值数据，按中性处理；PE不可用或为负，估值可信度较低；毛利率28.7%，处于一般水平；ROE 2.2%偏低；营收同比15.1%；利润同比-12.7% | 月涨幅分位94%；换手率6.07%；成交额20.5亿；价在MA20上方
603078,江化微,芯片智造,湿电子化学品,行业核心、国产替代,35.01,152.56,无,45.0,80.8,97.4,64.83,基本面45.0 | 短线80.8 | 中期97.4 | 国产替代、核心；缺少总市值数据，按中性处理；PE不可用或为负，估值可信度较低；毛利率27.1%，处于一般水平；ROE 1.4%偏低；营收同比16.9%；利润同比7.3% | 月涨幅分位64%；换手率16.68%；成交额35.7亿；价在MA20上方
2938,鹏鼎控股,芯片智造,PCB,参股礼鼎、全球PCB龙头、HBM载板核心,47.94,103.71,无,44.0,29.9,65.1,85.67,基本面44.0 | 短线29.9 | 中期65.1 | PCB、龙头、核心；缺少总市值数据，按中性处理；PE不可用或为负，估值可信度较低；毛利率22.9%，处于一般水平；ROE 1.4%偏低；营收同比-1.2%；利润同比-5.2% | 月涨幅分位79%；换手率1.62%；成交额35.7亿；价在MA20下方
688396,华润微,芯片智造,功率半导体,行业核心、产能领先、技术领先,20.56,75.1,无,53.0,41.6,79.9,97.88,基本面53.0 | 短线41.6 | 中期79.9 | 产能领先、技术领先、核心；缺少总市值数据，按中性处理；PE不可用或为负，估值可信度较低；毛利率25.5%，处于一般水平；ROE 1.4%偏低；营收同比21.3%；利润同比296.6% | 月涨幅分位41%；换手率2.92%；成交额33.1亿；价在MA20上方
2463,沪电股份,芯片智造,PCB、ABF载板,高速PCB龙头、ABF领先、产能规模大、客户优质,25.89,94.38,无,64.0,33.1,63.0,145.53,基本面64.0 | 短线33.1 | 中期63.0 | ABF载板、PCB、龙头、客户优质；缺少总市值数据，按中性处理；PE不可用或为负，估值可信度较低；毛利率35.6%，盈利能力良好；ROE 7.8%；营收同比53.9%；利润同比62.9% | 月涨幅分位51%；换手率3.93%；成交额97.6亿；价在MA20下方
300331,苏大维格,芯片智造,光刻设备,掩膜核心、国产替代,4.18,104.54,无,55.0,26.5,67.4,69.68,基本面55.0 | 短线26.5 | 中期67.4 | 光刻设备、国产替代、核心；缺少总市值数据，按中性处理；PE不可用或为负，估值可信度较低；毛利率27.1%，处于一般水平；ROE 2.0%偏低；营收同比15.0%；利润同比73.2% | 月涨幅分位13%；换手率5.78%；成交额8.3亿；价在MA20下方
300263,隆华科技,芯片智造,靶材,核心供应商、国产替代,23.94,70.84,无,46.0,35.2,65.1,14.87,基本面46.0 | 短线35.2 | 中期65.1 | 国产替代、核心供应商、核心；缺少总市值数据，按中性处理；PE不可用或为负，估值可信度较低；毛利率18.5%，利润垫偏薄；ROE 1.6%偏低；营收同比29.7%；利润同比43.4% | 月涨幅分位46%；换手率9.19%；成交额13.3亿；价在MA20下方
301511,德福科技,芯片智造,铜箔,HVLP5送样、AI服务器第一供应商、产能全球最大,74.92,290.73,无,38.0,51.6,77.6,144.95,基本面38.0 | 短线51.6 | 中期77.6 | 铜箔；缺少总市值数据，按中性处理；PE不可用或为负，估值可信度较低；毛利率9.1%，竞争压力较大；ROE 3.5%偏低；营收同比73.5%；利润同比708.9% | 月涨幅分位94%；换手率11.08%；成交额57.5亿；价在MA20下方
605358,立昂微,芯片智造,大硅片,8英寸核心、国产替代,47.56,126.57,无,45.0,42.8,60.1,63.77,基本面45.0 | 短线42.8 | 中期60.1 | 国产替代、核心；缺少总市值数据，按中性处理；PE不可用或为负，估值可信度较低；毛利率15.6%，利润垫偏薄；ROE 0.1%偏低；营收同比21.8%；利润同比108.9% | 月涨幅分位75%；换手率10.23%；成交额48.1亿；价在MA20下方
688082,盛美上海,芯片智造,薄膜沉积、韬定律,电镀核心、国产替代,52.55,154.44,无,53.0,43.9,83.3,368.51,基本面53.0 | 短线43.9 | 中期83.3 | 薄膜沉积、国产替代、核心；缺少总市值数据，按中性处理；PE不可用或为负，估值可信度较低；毛利率45.6%，盈利能力优秀；ROE 0.8%偏低；营收同比13.1%；利润同比-57.7% | 月涨幅分位81%；换手率1.96%；成交额34.4亿；价在MA20上方
688041,海光信息,芯片智造,AI算力芯片,行业龙头、产能领先、国产替代,11.15,58.29,无,66.0,34.1,76.1,381.15,基本面66.0 | 短线34.1 | 中期76.1 | AI算力芯片、行业龙头、龙头、产能领先、国产替代；缺少总市值数据，按中性处理；PE不可用或为负，估值可信度较低；毛利率55.6%，盈利壁垒强；ROE 3.0%偏低；营收同比68.1%；利润同比35.8% | 月涨幅分位26%；换手率1.57%；成交额124.2亿；价在MA20上方
688135,利扬芯片,芯片智造,传统封测、韬定律,测试服务核心、国产替代,6.14,45.71,无,49.0,40.3,77.0,43.89,基本面49.0 | 短线40.3 | 中期77.0 | 国产替代、核心；缺少总市值数据，按中性处理；PE不可用或为负，估值可信度较低；毛利率27.4%，处于一般水平；ROE 0.3%偏低；营收同比27.9%；利润同比145.1% | 月涨幅分位17%；换手率10.51%；成交额9.5亿；价在MA20上方
688795,摩尔线程,芯片智造,AI算力芯片,算力芯片核心、国产GPU龙头,5.56,19.61,无,68.0,20.3,28.1,670.24,基本面68.0 | 短线20.3 | 中期28.1 | AI算力芯片、龙头、核心；缺少总市值数据，按中性处理；PE不可用或为负，估值可信度较低；毛利率67.4%，盈利壁垒强；ROE 0.3%偏低；营收同比155.3%；利润同比126.1% | 月涨幅分位16%；换手率6.65%；成交额12.7亿；价在MA20下方
688361,中科飞测,芯片智造,刻蚀设备、韬定律,检测核心、技术突破,40.01,145.92,无,57.0,51.9,80.9,346.14,基本面57.0 | 短线51.9 | 中期80.9 | 刻蚀设备、技术突破、核心；缺少总市值数据，按中性处理；PE不可用或为负，估值可信度较低；毛利率47.8%，盈利能力优秀；ROE -1.3%偏低；营收同比34.6%；利润同比-354.3% | 月涨幅分位69%；换手率3.31%；成交额39.8亿；价在MA20上方
300706,阿石创,芯片智造,靶材,核心供应商、国产替代,25.48,170.79,无,50.0,43.5,66.8,76.64,基本面50.0 | 短线43.5 | 中期66.8 | 国产替代、核心供应商、核心；缺少总市值数据，按中性处理；PE不可用或为负，估值可信度较低；毛利率12.5%，利润垫偏薄；ROE 2.6%偏低；营收同比41.6%；利润同比572.4% | 月涨幅分位49%；换手率16.75%；成交额13.3亿；价在MA20下方
688362,甬矽电子,芯片智造,传统封测,封测核心、国产替代、技术领先,47.28,162.11,无,44.0,82.6,95.4,107.32,基本面44.0 | 短线82.6 | 中期95.4 | 技术领先、国产替代、核心；缺少总市值数据，按中性处理；PE不可用或为负，估值可信度较低；毛利率17.5%，利润垫偏薄；ROE 1.0%偏低；营收同比24.0%；利润同比8.2% | 月涨幅分位74%；换手率11.08%；成交额47.1亿；价在MA20上方
603297,永新光学,芯片智造,光刻设备,镜头核心、配套龙头,21.23,35.63,无,53.0,21.0,39.1,104.73,基本面53.0 | 短线21.0 | 中期39.1 | 光刻设备、龙头、核心；缺少总市值数据，按中性处理；PE不可用或为负，估值可信度较低；毛利率36.8%，盈利能力良好；ROE 2.2%偏低；营收同比20.1%；利润同比-17.1% | 月涨幅分位43%；换手率1.93%；成交额2.6亿；价在MA20下方
688147,微导纳米,芯片智造,薄膜沉积、韬定律、键合,ALD核心、技术领先,25.12,121.34,无,48.0,49.8,80.0,131.41,基本面48.0 | 短线49.8 | 中期80.0 | 薄膜沉积、技术领先、核心；缺少总市值数据，按中性处理；PE不可用或为负，估值可信度较低；毛利率32.8%，盈利能力良好；ROE 0.7%偏低；营收同比-5.5%；利润同比-75.0% | 月涨幅分位47%；换手率2.89%；成交额18.2亿；价在MA20上方
601869,长飞光纤,光模块,光纤光缆,全球光纤龙头、技术标杆、海外拓展、产能领先,-0.56,352.99,无,63.0,26.9,61.4,492.17,基本面63.0 | 短线26.9 | 中期61.4 | 光纤光缆、龙头、技术标杆、产能领先、海外拓展；缺少总市值数据，按中性处理；PE不可用或为负，估值可信度较低；毛利率41.5%，盈利能力优秀；ROE 3.5%偏低；营收同比27.7%；利润同比226.4% | 月涨幅分位8%；换手率3.36%；成交额61.4亿；价在MA20下方
600460,士兰微,芯片智造,功率半导体,行业核心、IDM龙头、国产替代,27.89,85.11,无,49.0,54.1,78.2,51.24,基本面49.0 | 短线54.1 | 中期78.2 | 龙头、国产替代、核心；缺少总市值数据，按中性处理；PE不可用或为负，估值可信度较低；毛利率19.8%，利润垫偏薄；ROE 1.7%偏低；营收同比17.3%；利润同比40.6% | 月涨幅分位53%；换手率6.86%；成交额53.5亿；价在MA20上方
688347,华虹公司,芯片智造,先进制程、韬定律,晶圆代工核心、产能领先、国产替代,55.34,214.4,无,52.0,65.8,92.9,370.53,基本面52.0 | 短线65.8 | 中期92.9 | 先进制程、产能领先、国产替代、核心；缺少总市值数据，按中性处理；PE不可用或为负，估值可信度较低；毛利率17.6%，利润垫偏薄；ROE 0.3%偏低；营收同比18.2%；利润同比513.1% | 月涨幅分位84%；换手率6.49%；成交额79.4亿；价在MA20上方
688138,清溢光电,芯片智造,光刻设备,配套核心、技术领先,12.23,67.62,无,53.0,33.4,67.9,42.19,基本面53.0 | 短线33.4 | 中期67.9 | 光刻设备、技术领先、核心；缺少总市值数据，按中性处理；PE不可用或为负，估值可信度较低；毛利率31.3%，盈利能力良好；ROE 2.0%偏低；营收同比10.7%；利润同比7.6% | 月涨幅分位29%；换手率4.13%；成交额5.4亿；价在MA20上方
688432,有研硅,芯片智造,大硅片,核心供应商、技术领先,26.39,200.0,无,49.0,63.2,86.7,38.82,基本面49.0 | 短线63.2 | 中期86.7 | 技术领先、核心供应商、核心；缺少总市值数据，按中性处理；PE不可用或为负，估值可信度较低；毛利率31.6%，盈利能力良好；ROE 1.1%偏低；营收同比18.0%；利润同比-1.2% | 月涨幅分位51%；换手率5.21%；成交额25.8亿；价在MA20上方
600498,烽火通信,光模块,高速光模块、光纤光缆,央企龙头、电信核心、全产业链、技术储备,-3.85,124.66,无,47.0,25.4,38.3,49.24,基本面47.0 | 短线25.4 | 中期38.3 | 高速光模块、光纤光缆、龙头、全产业链、核心；缺少总市值数据，按中性处理；PE不可用或为负，估值可信度较低；毛利率26.4%，处于一般水平；ROE 0.2%偏低；营收同比11.4%；利润同比-30.4% | 月涨幅分位5%；换手率6.65%；成交额50.1亿；价在MA20下方
300260,新莱应材,芯片智造,CMP设备,零部件核心、国产替代,16.83,82.11,无,48.0,45.6,73.4,89.88,基本面48.0 | 短线45.6 | 中期73.4 | CMP设备、国产替代、核心；缺少总市值数据，按中性处理；PE不可用或为负，估值可信度较低；毛利率22.2%，处于一般水平；ROE 2.4%偏低；营收同比14.1%；利润同比3.6% | 月涨幅分位35%；换手率7.72%；成交额19.3亿；价在MA20上方
300576,容大感光,芯片智造,光刻胶,核心供应商、技术领先,21.55,43.11,无,50.0,24.5,53.5,38.83,基本面50.0 | 短线24.5 | 中期53.5 | 光刻胶、技术领先、核心供应商、核心；缺少总市值数据，按中性处理；PE不可用或为负，估值可信度较低；毛利率35.5%，盈利能力良好；ROE 1.6%偏低；营收同比12.1%；利润同比-22.4% | 月涨幅分位44%；换手率9.60%；成交额11.1亿；价在MA20下方
688126,沪硅产业,芯片智造,大硅片,12英寸龙头、产能领先,34.95,80.22,无,41.0,53.3,74.9,32.65,基本面41.0 | 短线53.3 | 中期74.9 | 龙头、产能领先；缺少总市值数据，按中性处理；PE不可用或为负，估值可信度较低；毛利率-11.8%，竞争压力较大；ROE -2.9%偏低；营收同比35.2%；利润同比-131.7% | 月涨幅分位64%；换手率5.44%；成交额53.3亿；价在MA20上方
300537,广信材料,芯片智造,光刻胶,核心供应商、技术突破,22.7,44.85,无,50.0,38.3,53.0,26.42,基本面50.0 | 短线38.3 | 中期53.0 | 光刻胶、技术突破、核心供应商、核心；缺少总市值数据，按中性处理；PE不可用或为负，估值可信度较低；毛利率33.4%，盈利能力良好；ROE 0.8%偏低；营收同比7.0%；利润同比-23.2% | 月涨幅分位45%；换手率13.29%；成交额6.0亿；价在MA20下方
688296,和林微纳,光模块,DSP芯片,高速DSP核心、技术研发、高壁垒、高毛利,8.37,-14.26,无,51.0,25.6,13.1,10.63,基本面51.0 | 短线25.6 | 中期13.1 | 高毛利、核心；缺少总市值数据，按中性处理；PE不可用或为负，估值可信度较低；毛利率35.2%，盈利能力良好；ROE -2.2%偏低；营收同比17.1%；利润同比11.4% | 月涨幅分位20%；换手率2.67%；成交额0.3亿；价在MA20下方
2617,露笑科技,芯片智造,碳化硅基板,碳化硅核心厂商、量产落地、产能布局、技术储备,32.24,24.94,无,36.0,39.1,52.5,7.71,基本面36.0 | 短线39.1 | 中期52.5 | 碳化硅基板、核心；缺少总市值数据，按中性处理；PE不可用或为负，估值可信度较低；毛利率19.4%，利润垫偏薄；ROE 1.1%偏低；营收同比11.3%；利润同比-27.7% | 月涨幅分位60%；换手率7.91%；成交额13.5亿；价在MA20下方
600641,万业企业,芯片智造,刻蚀设备,行业核心、国产替代,-1.58,105.44,无,49.0,64.8,88.2,47.57,基本面49.0 | 短线64.8 | 中期88.2 | 刻蚀设备、国产替代、核心；缺少总市值数据，按中性处理；PE不可用或为负，估值可信度较低；毛利率18.5%，利润垫偏薄；ROE -0.2%偏低；营收同比178.2%；利润同比17.5% | 月涨幅分位6%；换手率15.89%；成交额65.7亿；价在MA20上方
600703,三安光电,芯片智造,功率半导体、碳化硅基板、高速光芯片,SiC/GaN龙头、化合物半导体龙头、产能领先,9.93,49.04,无,41.0,28.1,53.7,14.97,基本面41.0 | 短线28.1 | 中期53.7 | 高速光芯片、碳化硅基板、龙头、产能领先；缺少总市值数据，按中性处理；PE不可用或为负，估值可信度较低；毛利率18.5%，利润垫偏薄；ROE 0.2%偏低；营收同比-32.6%；利润同比-68.2% | 月涨幅分位22%；换手率5.72%；成交额50.8亿；价在MA20下方
300548,博创科技,光模块,高速光模块、硅光模块,二线弹性、双轨布局、海外拓展、小而美,-11.2,78.3,无,60.0,16.4,40.1,215.16,基本面60.0 | 短线16.4 | 中期40.1 | 高速光模块、硅光模块、海外拓展；缺少总市值数据，按中性处理；PE不可用或为负，估值可信度较低；毛利率49.2%，盈利能力优秀；ROE 6.4%；营收同比24.5%；利润同比45.0% | 月涨幅分位3%；换手率4.64%；成交额27.2亿；价在MA20下方
688172,燕东微,芯片智造,先进制程,晶圆代工核心、国产替代,56.39,197.06,无,41.0,43.9,86.2,72.71,基本面41.0 | 短线43.9 | 中期86.2 | 先进制程、国产替代、核心；缺少总市值数据，按中性处理；PE不可用或为负，估值可信度较低；毛利率-2.0%，竞争压力较大；ROE -1.4%偏低；营收同比75.8%；利润同比-23.0% | 月涨幅分位86%；换手率2.47%；成交额21.8亿；价在MA20上方
2741,光华科技,芯片智造,湿电子化学品,行业核心、国产替代,48.64,76.35,无,47.0,34.3,61.0,33.77,基本面47.0 | 短线34.3 | 中期61.0 | 国产替代、核心；缺少总市值数据，按中性处理；PE不可用或为负，估值可信度较低；毛利率15.1%，利润垫偏薄；ROE 2.1%偏低；营收同比64.9%；利润同比63.2% | 月涨幅分位80%；换手率8.20%；成交额11.2亿；价在MA20下方
688729,屹唐股份,芯片智造,刻蚀设备,行业核心、技术突破,11.92,55.79,无,51.0,49.1,76.6,36.51,基本面51.0 | 短线49.1 | 中期76.6 | 刻蚀设备、技术突破、核心；缺少总市值数据，按中性处理；PE不可用或为负，估值可信度较低；毛利率40.0%，盈利能力优秀；ROE 1.8%偏低；营收同比-10.6%；利润同比-26.8% | 月涨幅分位28%；换手率24.65%；成交额20.0亿；价在MA20上方
688047,龙芯中科,芯片智造,AI算力芯片,国产CPU龙头、技术自主,-0.16,11.2,无,56.0,10.1,20.6,132.05,基本面56.0 | 短线10.1 | 中期20.6 | AI算力芯片、龙头；缺少总市值数据，按中性处理；PE不可用或为负，估值可信度较低；毛利率34.9%，盈利能力良好；ROE -4.7%偏低；营收同比8.0%；利润同比24.7% | 月涨幅分位9%；换手率2.60%；成交额14.5亿；价在MA20下方
300655,晶瑞电材,芯片智造,光刻胶,核心供应商、国产替代,7.3,26.51,无,46.0,43.7,58.1,16.68,基本面46.0 | 短线43.7 | 中期58.1 | 光刻胶、国产替代、核心供应商、核心；缺少总市值数据，按中性处理；PE不可用或为负，估值可信度较低；毛利率21.4%，处于一般水平；ROE 0.2%偏低；营收同比13.4%；利润同比-84.6% | 月涨幅分位18%；换手率10.53%；成交额21.9亿；价在MA20上方
688584,上海合晶,芯片智造,大硅片,核心供应商、技术突破,30.42,63.17,无,41.0,43.4,68.8,28.37,基本面41.0 | 短线43.4 | 中期68.8 | 技术突破、核心供应商、核心；缺少总市值数据，按中性处理；PE不可用或为负，估值可信度较低；毛利率28.1%，处于一般水平；ROE 0.3%偏低；营收同比-0.0%；利润同比-34.7% | 月涨幅分位58%；换手率5.99%；成交额6.4亿；价在MA20上方
300476,胜宏科技,芯片智造,PCB,高速PCB核心、产能领先、客户优质,20.19,10.43,无,60.0,25.5,29.0,291.67,基本面60.0 | 短线25.5 | 中期29.0 | PCB、产能领先、客户优质、核心；缺少总市值数据，按中性处理；PE不可用或为负，估值可信度较低；毛利率34.5%，盈利能力良好；ROE 7.6%；营收同比28.0%；利润同比39.9% | 月涨幅分位40%；换手率4.04%；成交额103.2亿；价在MA20下方
600206,有研新材,芯片智造,靶材,高纯靶材核心、技术领先,5.67,227.58,无,41.0,56.9,82.5,55.16,基本面41.0 | 短线56.9 | 中期82.5 | 技术领先、核心；缺少总市值数据，按中性处理；PE不可用或为负，估值可信度较低；毛利率6.4%，竞争压力较大；ROE 2.0%偏低；营收同比60.7%；利润同比31.0% | 月涨幅分位16%；换手率12.96%；成交额57.6亿；价在MA20上方
688249,晶合集成,芯片智造,先进制程,晶圆代工核心、技术突破,45.03,78.55,无,45.0,68.9,89.6,62.1,基本面45.0 | 短线68.9 | 中期89.6 | 先进制程、技术突破、核心；缺少总市值数据，按中性处理；PE不可用或为负，估值可信度较低；毛利率21.3%，处于一般水平；ROE 0.2%偏低；营收同比13.4%；利润同比-62.6% | 月涨幅分位72%；换手率4.32%；成交额51.4亿；价在MA20上方
301217,铜冠铜箔,芯片智造,铜箔,HVLP全谱系、ABF载板核心、英伟达/深南供应链,116.85,368.73,无,40.0,46.5,75.2,157.17,基本面40.0 | 短线46.5 | 中期75.2 | 铜箔、核心；缺少总市值数据，按中性处理；PE不可用或为负，估值可信度较低；毛利率8.8%，竞争压力较大；ROE 1.9%偏低；营收同比32.0%；利润同比2138.2% | 月涨幅分位99%；换手率5.04%；成交额63.7亿；价在MA20下方
688981,中芯国际,芯片智造,先进制程、韬定律,晶圆代工龙头、产能领先、技术标杆,31.78,22.93,00981,50.0,43.8,73.1,149.3,基本面50.0 | 短线43.8 | 中期73.1 | 先进制程、龙头、技术标杆、产能领先；缺少总市值数据，按中性处理；PE不可用或为负，估值可信度较低；毛利率21.5%，处于一般水平；ROE 0.9%偏低；营收同比8.1%；利润同比0.4% | 月涨幅分位60%；换手率4.48%；成交额127.4亿；价在MA20上方
688403,汇成股份,芯片智造,传统封测,封测核心、技术突破、国产替代,25.87,145.07,无,39.0,54.7,89.2,34.76,基本面39.0 | 短线54.7 | 中期89.2 | 技术突破、国产替代、核心；缺少总市值数据，按中性处理；PE不可用或为负，估值可信度较低；毛利率14.5%，利润垫偏薄；ROE -0.4%偏低；营收同比9.7%；利润同比-131.6% | 月涨幅分位50%；换手率8.92%；成交额31.8亿；价在MA20上方
688783,西安奕材,芯片智造,大硅片,核心供应商、国产替代,46.64,157.69,无,35.0,58.1,82.4,49.11,基本面35.0 | 短线58.1 | 中期82.4 | 国产替代、核心供应商、核心；缺少总市值数据，按中性处理；PE不可用或为负，估值可信度较低；毛利率2.6%，竞争压力较大；ROE -1.3%偏低；营收同比10.6%；利润同比-9.3% | 月涨幅分位73%；换手率11.85%；成交额11.5亿；价在MA20上方
688262,国芯科技,芯片智造,车规芯片,车规MCU核心、技术领先,11.08,31.4,无,46.0,37.6,71.5,37.06,基本面46.0 | 短线37.6 | 中期71.5 | 车规芯片、技术领先、核心；缺少总市值数据，按中性处理；PE不可用或为负，估值可信度较低；毛利率22.9%，处于一般水平；ROE -2.5%偏低；营收同比79.5%；利润同比-40.0% | 月涨幅分位25%；换手率7.12%；成交额9.3亿；价在MA20上方
688020,方邦股份,芯片智造,先进封装,电磁屏蔽核心、技术领先,28.99,226.37,无,43.0,45.3,86.9,213.47,基本面43.0 | 短线45.3 | 中期86.9 | 先进封装、技术领先、核心；缺少总市值数据，按中性处理；PE不可用或为负，估值可信度较低；毛利率29.1%，处于一般水平；ROE -1.3%偏低；营收同比-9.9%；利润同比-1305.9% | 月涨幅分位56%；换手率5.09%；成交额9.8亿；价在MA20上方
603690,至纯科技,芯片智造,刻蚀设备,湿法核心、国产替代,7.83,12.53,无,44.0,41.3,59.0,29.99,基本面44.0 | 短线41.3 | 中期59.0 | 刻蚀设备、国产替代、核心；缺少总市值数据，按中性处理；PE不可用或为负，估值可信度较低；毛利率27.1%，处于一般水平；ROE -2.0%偏低；营收同比-14.7%；利润同比-232.8% | 月涨幅分位19%；换手率10.72%；成交额13.5亿；价在MA20上方
688469,芯联集成,芯片智造,先进制程,晶圆代工核心、国产替代,27.89,51.72,无,44.0,36.7,72.3,9.95,基本面44.0 | 短线36.7 | 中期72.3 | 先进制程、国产替代、核心；缺少总市值数据，按中性处理；PE不可用或为负，估值可信度较低；毛利率5.7%，竞争压力较大；ROE -0.7%偏低；营收同比13.2%；利润同比51.5% | 月涨幅分位53%；换手率4.64%；成交额25.0亿；价在MA20上方
688595,芯海科技,芯片智造,车规芯片,核心供应商、技术领先,-0.47,27.74,无,45.0,29.3,68.8,35.62,基本面45.0 | 短线29.3 | 中期68.8 | 车规芯片、技术领先、核心供应商、核心；缺少总市值数据，按中性处理；PE不可用或为负，估值可信度较低；毛利率29.6%，处于一般水平；ROE -5.3%偏低；营收同比12.1%；利润同比-62.2% | 月涨幅分位8%；换手率5.17%；成交额2.9亿；价在MA20上方
