股票代码,股票名称,行业,细分赛道,标签,月涨幅(%),年涨幅(%),港股代码,基本面打分,短线打分,长线打分,目标价,备注
688525,佰维存储,芯片智造,存储芯片,核心供应商、技术领先,18.95,342.49,无,74.0,62.7,88.9,573.31,基本面74.0 | 短线62.7 | 中期88.9 | 存储芯片、技术领先、核心供应商、核心；缺少总市值数据，按中性处理；PE不可用或为负，估值可信度较低；毛利率53.3%，盈利壁垒强；ROE 42.0%；营收同比341.5%；利润同比1567.9% | 月涨幅分位39%；换手率9.32%；成交额196.4亿；价在MA20上方
301308,江波龙,芯片智造,存储芯片,核心供应商、技术突破,47.8,196.53,无,74.0,78.2,93.4,881.64,基本面74.0 | 短线78.2 | 中期93.4 | 存储芯片、技术突破、核心供应商、核心；缺少总市值数据，按中性处理；PE不可用或为负，估值可信度较低；毛利率55.5%，盈利壁垒强；ROE 39.4%；营收同比132.8%；利润同比2644.0% | 月涨幅分位78%；换手率10.48%；成交额202.3亿；价在MA20上方
603986,兆易创新,芯片智造,存储芯片,行业龙头、产能领先、国产替代,72.97,293.44,03986,70.0,65.0,85.1,813.09,基本面70.0 | 短线65.0 | 中期85.1 | 存储芯片、行业龙头、龙头、产能领先、国产替代；缺少总市值数据，按中性处理；PE不可用或为负，估值可信度较低；毛利率57.1%，盈利壁垒强；ROE 6.1%；营收同比119.4%；利润同比522.8% | 月涨幅分位92%；换手率9.00%；成交额397.7亿；价在MA20上方
300604,长川科技,芯片智造,刻蚀设备,测试核心、国产替代,39.37,233.86,无,69.0,61.0,91.9,379.03,基本面69.0 | 短线61.0 | 中期91.9 | 刻蚀设备、国产替代、核心；缺少总市值数据，按中性处理；PE不可用或为负，估值可信度较低；毛利率56.8%，盈利壁垒强；ROE 7.2%；营收同比69.1%；利润同比217.6% | 月涨幅分位68%；换手率5.37%；成交额79.5亿；价在MA20上方
300042,朗科科技,芯片智造,存储芯片,核心供应商、国产替代,32.34,178.89,无,58.0,41.3,71.3,76.69,基本面58.0 | 短线41.3 | 中期71.3 | 存储芯片、国产替代、核心供应商、核心；缺少总市值数据，按中性处理；PE不可用或为负，估值可信度较低；毛利率25.2%，处于一般水平；ROE 7.5%；营收同比107.8%；利润同比744.4% | 月涨幅分位61%；换手率11.32%；成交额15.4亿；价在MA20下方
300054,鼎龙股份,芯片智造,CMP设备、韬定律,抛光垫龙头、产能领先,28.77,177.33,无,66.0,46.6,82.1,108.23,基本面66.0 | 短线46.6 | 中期82.1 | CMP设备、龙头、产能领先；缺少总市值数据，按中性处理；PE不可用或为负，估值可信度较低；毛利率54.9%，盈利壁垒强；ROE 4.7%偏低；营收同比23.8%；利润同比78.0% | 月涨幅分位55%；换手率5.73%；成交额38.4亿；价在MA20上方
603083,剑桥科技,光模块,高速光模块、LPO模块,弹性龙头、业绩高增、北美订单、资金关注,22.87,84.77,06166,58.0,33.9,60.8,217.29,基本面58.0 | 短线33.9 | 中期60.8 | 高速光模块、龙头；缺少总市值数据，按中性处理；PE不可用或为负，估值可信度较低；毛利率29.3%，处于一般水平；ROE 1.6%偏低；营收同比44.0%；利润同比276.4% | 月涨幅分位45%；换手率7.64%；成交额42.3亿；价在MA20下方
300308,中际旭创,光模块,高速光模块、硅光模块、LPO模块、CPO光引擎,全球龙头、英伟达核心、技术标杆、机构重仓,25.45,100.33,无,71.0,30.8,64.0,1266.73,基本面71.0 | 短线30.8 | 中期64.0 | CPO光引擎、高速光模块、硅光模块、全球龙头、龙头、技术标杆、机构重仓、核心；缺少总市值数据，按中性处理；PE不可用或为负，估值可信度较低；毛利率46.1%，盈利能力优秀；ROE 17.5%；营收同比192.1%；利润同比262.3% | 月涨幅分位48%；换手率2.84%；成交额347.0亿；价在MA20下方
688072,拓荆科技,芯片智造,薄膜沉积、韬定律、键合,PECVD龙头、产能领先,73.44,152.37,无,67.0,74.4,92.3,1048.9,基本面67.0 | 短线74.4 | 中期92.3 | 薄膜沉积、龙头、产能领先；缺少总市值数据，按中性处理；PE不可用或为负，估值可信度较低；毛利率41.7%，盈利能力优秀；ROE 8.2%；营收同比57.0%；利润同比488.3% | 月涨幅分位93%；换手率2.84%；成交额66.9亿；价在MA20上方
688498,源杰科技,光模块,高速光芯片,光芯片龙头、EML量产、技术壁垒、国产核心,16.77,289.62,无,70.0,34.4,79.6,1944.71,基本面70.0 | 短线34.4 | 中期79.6 | 高速光芯片、龙头、核心；缺少总市值数据，按中性处理；PE不可用或为负，估值可信度较低；毛利率77.8%，盈利壁垒强；ROE 7.4%；营收同比320.9%；利润同比1153.1% | 月涨幅分位34%；换手率3.47%；成交额69.5亿；价在MA20下方
688019,安集科技,芯片智造,CMP设备,抛光液龙头、产能领先,27.12,82.24,无,68.0,48.3,75.2,333.0,基本面68.0 | 短线48.3 | 中期75.2 | CMP设备、龙头、产能领先；缺少总市值数据，按中性处理；PE不可用或为负，估值可信度较低；毛利率55.5%，盈利壁垒强；ROE 5.7%；营收同比32.8%；利润同比23.0% | 月涨幅分位52%；换手率5.14%；成交额34.1亿；价在MA20上方
988,华工科技,光模块,高速光模块,全能龙头、NPO落地、国资背景、协同布局,38.64,123.86,无,54.0,36.7,59.7,163.69,基本面54.0 | 短线36.7 | 中期59.7 | 高速光模块、龙头、国资背景；缺少总市值数据，按中性处理；PE不可用或为负，估值可信度较低；毛利率19.8%，利润垫偏薄；ROE 5.6%；营收同比27.1%；利润同比55.8% | 月涨幅分位67%；换手率4.84%；成交额73.2亿；价在MA20下方
2281,光迅科技,光模块,硅光模块、高速光芯片、光纤光缆,国家队龙头、全产业链、双轨覆盖、技术储备,57.5,237.3,无,56.0,42.8,72.1,237.12,基本面56.0 | 短线42.8 | 中期72.1 | 硅光模块、高速光芯片、光纤光缆、国家队龙头、龙头、全产业链；缺少总市值数据，按中性处理；PE不可用或为负，估值可信度较低；毛利率26.8%，处于一般水平；ROE 2.4%偏低；营收同比24.8%；利润同比59.8% | 月涨幅分位87%；换手率4.39%；成交额72.5亿；价在MA20下方
688313,仕佳光子,光模块,硅光模块,硅光黑马、无源龙头、自主可控、技术壁垒,8.01,98.12,无,62.0,24.6,48.7,154.82,基本面62.0 | 短线24.6 | 中期48.7 | 硅光模块、龙头、自主可控；缺少总市值数据，按中性处理；PE不可用或为负，估值可信度较低；毛利率34.1%，盈利能力良好；ROE 7.2%；营收同比32.2%；利润同比24.7% | 月涨幅分位19%；换手率5.68%；成交额38.3亿；价在MA20下方
21,深科技,芯片智造,存储芯片,存储连接芯片、核心供应商、国产替代,52.44,134.88,无,46.0,67.0,78.1,59.04,基本面46.0 | 短线67.0 | 中期78.1 | 存储芯片、国产替代、核心供应商、核心；缺少总市值数据，按中性处理；PE不可用或为负，估值可信度较低；毛利率17.1%，利润垫偏薄；ROE 1.8%偏低；营收同比10.7%；利润同比35.3% | 月涨幅分位81%；换手率10.45%；成交额89.8亿；价在MA20上方
688008,澜起科技,芯片智造,存储芯片,内存接口龙头、技术标杆,62.39,151.32,06889,68.0,65.0,85.1,332.01,基本面68.0 | 短线65.0 | 中期85.1 | 存储芯片、龙头、技术标杆；缺少总市值数据，按中性处理；PE不可用或为负，估值可信度较低；毛利率69.8%，盈利壁垒强；ROE 5.4%；营收同比19.5%；利润同比61.3% | 月涨幅分位90%；换手率5.53%；成交额168.9亿；价在MA20上方
300666,江丰电子,芯片智造,靶材,高纯靶材龙头、产能领先,17.64,317.46,无,58.0,56.8,82.9,373.93,基本面58.0 | 短线56.8 | 中期82.9 | 龙头、产能领先；缺少总市值数据，按中性处理；PE不可用或为负，估值可信度较低；毛利率32.9%，盈利能力良好；ROE 4.1%偏低；营收同比30.5%；利润同比33.4% | 月涨幅分位37%；换手率7.79%；成交额56.8亿；价在MA20上方
300502,新易盛,光模块,高速光模块、LPO模块、硅光模块,全球第二、北美核心、LPO标杆、高毛利,29.36,81.38,无,69.0,34.4,60.9,580.34,基本面69.0 | 短线34.4 | 中期60.9 | 高速光模块、硅光模块、高毛利、核心；缺少总市值数据，按中性处理；PE不可用或为负，估值可信度较低；毛利率49.2%，盈利能力优秀；ROE 14.5%；营收同比105.8%；利润同比76.8% | 月涨幅分位56%；换手率3.44%；成交额221.5亿；价在MA20下方
300346,南大光电,芯片智造,光刻胶,ArF龙头、产能领先,5.48,111.17,无,59.0,52.4,73.3,87.2,基本面59.0 | 短线52.4 | 中期73.3 | 光刻胶、龙头、产能领先；缺少总市值数据，按中性处理；PE不可用或为负，估值可信度较低；毛利率41.9%，盈利能力优秀；ROE 3.5%偏低；营收同比5.5%；利润同比30.0% | 月涨幅分位15%；换手率11.13%；成交额57.6亿；价在MA20上方
688012,中微公司,芯片智造,刻蚀设备、韬定律,行业龙头、技术标杆、产能领先,40.72,149.83,无,62.0,64.1,86.4,510.7,基本面62.0 | 短线64.1 | 中期86.4 | 刻蚀设备、行业龙头、龙头、技术标杆、产能领先；缺少总市值数据，按中性处理；PE不可用或为负，估值可信度较低；毛利率39.9%，盈利能力良好；ROE 4.0%偏低；营收同比34.1%；利润同比197.2% | 月涨幅分位69%；换手率3.19%；成交额123.7亿；价在MA20上方
688120,华海清科,芯片智造,CMP设备、韬定律,行业龙头、产能领先,53.73,195.63,无,61.0,56.9,81.4,299.03,基本面61.0 | 短线56.9 | 中期81.4 | CMP设备、行业龙头、龙头、产能领先；缺少总市值数据，按中性处理；PE不可用或为负，估值可信度较低；毛利率42.3%，盈利能力优秀；ROE 3.3%偏低；营收同比31.7%；利润同比5.9% | 月涨幅分位83%；换手率3.50%；成交额46.5亿；价在MA20上方
300236,上海新阳,芯片智造,光刻胶,g线核心、国产替代,13.81,103.49,无,61.0,40.9,70.0,125.93,基本面61.0 | 短线40.9 | 中期70.0 | 光刻胶、国产替代、核心；缺少总市值数据，按中性处理；PE不可用或为负，估值可信度较低；毛利率42.2%，盈利能力优秀；ROE 1.9%偏低；营收同比33.0%；利润同比102.6% | 月涨幅分位31%；换手率4.88%；成交额15.1亿；价在MA20上方
2384,东山精密,光模块,高速光模块、CPO光引擎、PCB,体量最大、光芯片布局、CPO配套、产能领先,18.88,194.85,无,56.0,38.0,70.0,252.07,基本面56.0 | 短线38.0 | 中期70.0 | CPO光引擎、高速光模块、PCB、产能领先；缺少总市值数据，按中性处理；PE不可用或为负，估值可信度较低；毛利率19.3%，利润垫偏薄；ROE 5.0%；营收同比52.7%；利润同比143.5% | 月涨幅分位38%；换手率5.52%；成交额174.5亿；价在MA20下方
2916,深南电路,芯片智造,PCB、ABF载板,封装基板龙头、国内PCB龙头、产能领先,31.42,88.86,无,58.0,52.9,87.8,522.94,基本面58.0 | 短线52.9 | 中期87.8 | ABF载板、PCB、龙头、产能领先；缺少总市值数据，按中性处理；PE不可用或为负，估值可信度较低；毛利率29.2%，处于一般水平；ROE 4.8%偏低；营收同比37.9%；利润同比73.0% | 月涨幅分位59%；换手率2.29%；成交额67.0亿；价在MA20上方
2409,雅克科技,芯片智造,湿电子化学品,行业龙头、产能领先,32.9,181.15,无,52.0,66.5,82.3,204.41,基本面52.0 | 短线66.5 | 中期82.3 | 行业龙头、龙头、产能领先；缺少总市值数据，按中性处理；PE不可用或为负，估值可信度较低；毛利率31.2%，盈利能力良好；ROE 3.3%偏低；营收同比-6.9%；利润同比2.5% | 月涨幅分位62%；换手率12.88%；成交额77.8亿；价在MA20上方
688372,伟测科技,芯片智造,传统封测,测试服务核心、技术领先,16.15,56.03,无,55.0,72.0,77.8,214.54,基本面55.0 | 短线72.0 | 中期77.8 | 技术领先、核心；缺少总市值数据，按中性处理；PE不可用或为负，估值可信度较低；毛利率35.0%，盈利能力良好；ROE 2.4%偏低；营收同比71.8%；利润同比173.4% | 月涨幅分位33%；换手率12.18%；成交额35.9亿；价在MA20上方
688146,中船特气,芯片智造,电子特气,行业核心、国产替代,112.1,820.4,无,53.0,54.0,78.4,325.0,基本面53.0 | 短线54.0 | 中期78.4 | 电子特气、国产替代、核心；缺少总市值数据，按中性处理；PE不可用或为负，估值可信度较低；毛利率30.2%，盈利能力良好；ROE 1.7%偏低；营收同比36.0%；利润同比16.9% | 月涨幅分位97%；换手率9.21%；成交额43.4亿；价在MA20下方
600584,长电科技,芯片智造,传统封测、韬定律、先进封装,封测龙头、产能领先、技术标杆,91.94,181.49,无,46.0,74.6,89.7,108.62,基本面46.0 | 短线74.6 | 中期89.7 | 先进封装、龙头、技术标杆、产能领先；缺少总市值数据，按中性处理；PE不可用或为负，估值可信度较低；毛利率14.5%，利润垫偏薄；ROE 1.0%偏低；营收同比-1.8%；利润同比42.7% | 月涨幅分位96%；换手率11.65%；成交额197.5亿；价在MA20上方
600487,亨通光电,光模块,光纤光缆,光纤龙头、光棒自主、全产业链、产能领先,-1.22,341.7,无,54.0,34.8,57.3,91.86,基本面54.0 | 短线34.8 | 中期57.3 | 光纤光缆、龙头、产能领先、全产业链；缺少总市值数据，按中性处理；PE不可用或为负，估值可信度较低；毛利率16.0%，利润垫偏薄；ROE 3.4%偏低；营收同比34.1%；利润同比98.5% | 月涨幅分位7%；换手率8.13%；成交额171.3亿；价在MA20下方
300373,扬杰科技,芯片智造,功率半导体,行业核心、国产替代、技术领先,33.63,122.15,无,56.0,50.6,75.6,146.31,基本面56.0 | 短线50.6 | 中期75.6 | 技术领先、国产替代、核心；缺少总市值数据，按中性处理；PE不可用或为负，估值可信度较低；毛利率36.8%，盈利能力良好；ROE 4.0%偏低；营收同比34.9%；利润同比41.0% | 月涨幅分位63%；换手率4.41%；成交额31.2亿；价在MA20上方
688268,华特气体,芯片智造,电子特气,行业龙头、产能领先,-9.89,339.1,无,51.0,34.8,69.9,199.57,基本面51.0 | 短线34.8 | 中期69.9 | 电子特气、行业龙头、龙头、产能领先；缺少总市值数据，按中性处理；PE不可用或为负，估值可信度较低；毛利率30.2%，盈利能力良好；ROE 1.7%偏低；营收同比13.7%；利润同比-23.7% | 月涨幅分位3%；换手率6.41%；成交额17.8亿；价在MA20下方
600522,中天科技,芯片智造,铜箔,PET复合铜箔龙头、宁德时代绑定,17.59,224.72,无,46.0,40.9,61.1,49.69,基本面46.0 | 短线40.9 | 中期61.1 | 铜箔、龙头；缺少总市值数据，按中性处理；PE不可用或为负，估值可信度较低；毛利率15.6%，利润垫偏薄；ROE 2.4%偏低；营收同比34.7%；利润同比46.4% | 月涨幅分位36%；换手率7.87%；成交额131.4亿；价在MA20下方
300620,光库科技,光模块,高速光芯片,全产业链、DFB量产、技术储备、高弹性,9.33,148.69,无,60.0,21.3,56.6,321.99,基本面60.0 | 短线21.3 | 中期56.6 | 高速光芯片、全产业链；缺少总市值数据，按中性处理；PE不可用或为负，估值可信度较低；毛利率36.6%，盈利能力良好；ROE 2.0%偏低；营收同比60.8%；利润同比312.5% | 月涨幅分位21%；换手率3.80%；成交额28.5亿；价在MA20下方
688037,芯源微,芯片智造,光刻设备、韬定律、键合,行业龙头、产能领先,44.76,169.1,无,56.0,62.4,81.0,378.77,基本面56.0 | 短线62.4 | 中期81.0 | 光刻设备、行业龙头、龙头、产能领先；缺少总市值数据，按中性处理；PE不可用或为负，估值可信度较低；毛利率46.7%，盈利能力优秀；ROE 0.1%偏低；营收同比20.1%；利润同比-24.7% | 月涨幅分位71%；换手率4.51%；成交额33.1亿；价在MA20上方
688256,寒武纪,芯片智造,AI算力芯片,训练芯片核心、技术标杆,47.74,63.08,无,70.0,37.0,68.0,1597.81,基本面70.0 | 短线37.0 | 中期68.0 | AI算力芯片、技术标杆、核心；缺少总市值数据，按中性处理；PE不可用或为负，估值可信度较低；毛利率54.3%，盈利壁垒强；ROE 8.2%；营收同比159.6%；利润同比185.0% | 月涨幅分位77%；换手率1.65%；成交额140.5亿；价在MA20下方
688048,长光华芯,光模块,高速光芯片,激光芯片龙头、技术研发、机构重仓、储备充足,-6.58,233.73,无,62.0,54.4,79.9,505.66,基本面62.0 | 短线54.4 | 中期79.9 | 高速光芯片、龙头、机构重仓；缺少总市值数据，按中性处理；PE不可用或为负，估值可信度较低；毛利率30.1%，盈利能力良好；ROE 0.1%偏低；营收同比37.8%；利润同比159.7% | 月涨幅分位4%；换手率7.97%；成交额61.5亿；价在MA20上方
2185,华天科技,芯片智造,传统封测、韬定律,封测核心、技术领先、国产替代,61.85,100.18,无,50.0,58.8,79.4,22.97,基本面50.0 | 短线58.8 | 中期79.4 | 技术领先、国产替代、核心；缺少总市值数据，按中性处理；PE不可用或为负，估值可信度较低；毛利率11.3%，利润垫偏薄；ROE 0.5%偏低；营收同比34.5%；利润同比568.4% | 月涨幅分位89%；换手率10.44%；成交额69.9亿；价在MA20上方
688107,安路科技,芯片智造,车规芯片、DSP芯片,车规FPGA核心、国产DSP核心,53.09,52.39,无,55.0,37.7,77.5,45.98,基本面55.0 | 短线37.7 | 中期77.5 | 车规芯片、核心；缺少总市值数据，按中性处理；PE不可用或为负，估值可信度较低；毛利率41.3%，盈利能力优秀；ROE -4.4%偏低；营收同比77.5%；利润同比32.4% | 月涨幅分位82%；换手率3.13%；成交额5.2亿；价在MA20上方
300394,天孚通信,光模块,CPO光引擎,CPO龙头、封装核心、绑定头部、高毛利,32.34,104.23,无,68.0,34.9,32.1,247.56,基本面68.0 | 短线34.9 | 中期32.1 | CPO光引擎、龙头、高毛利、核心；缺少总市值数据，按中性处理；PE不可用或为负，估值可信度较低；毛利率56.6%，盈利壁垒强；ROE 8.6%；营收同比40.8%；利润同比45.8% | 月涨幅分位61%；换手率4.26%；成交额111.1亿；价在MA20下方
600183,生益科技,芯片智造,铜箔,ABF铜箔、覆铜板龙头、配套深南/兴森,81.41,142.4,无,54.0,39.1,74.7,173.87,基本面54.0 | 短线39.1 | 中期74.7 | 铜箔、龙头；缺少总市值数据，按中性处理；PE不可用或为负，估值可信度较低；毛利率28.1%，处于一般水平；ROE 6.7%；营收同比45.1%；利润同比105.5% | 月涨幅分位95%；换手率2.54%；成交额95.2亿；价在MA20下方
603893,瑞芯微,芯片智造,车规芯片,车规SoC核心、技术领先,13.02,1.58,无,62.0,27.6,41.2,188.59,基本面62.0 | 短线27.6 | 中期41.2 | 车规芯片、技术领先、核心；缺少总市值数据，按中性处理；PE不可用或为负，估值可信度较低；毛利率43.0%，盈利能力优秀；ROE 7.2%；营收同比36.2%；利润同比57.1% | 月涨幅分位31%；换手率3.32%；成交额24.7亿；价在MA20上方
2156,通富微电,芯片智造,传统封测、韬定律,封测核心、产能领先、国产替代,47.69,92.93,无,49.0,45.4,67.6,73.12,基本面49.0 | 短线45.4 | 中期67.6 | 产能领先、国产替代、核心；缺少总市值数据，按中性处理；PE不可用或为负，估值可信度较低；毛利率13.3%，利润垫偏薄；ROE 2.1%偏低；营收同比22.8%；利润同比224.5% | 月涨幅分位77%；换手率7.30%；成交额73.7亿；价在MA20下方
2222,福晶科技,芯片智造,光刻设备,晶体龙头、产能领先,12.32,50.34,无,63.0,18.2,26.0,79.69,基本面63.0 | 短线18.2 | 中期26.0 | 光刻设备、龙头、产能领先；缺少总市值数据，按中性处理；PE不可用或为负，估值可信度较低；毛利率44.9%，盈利能力优秀；ROE 3.6%偏低；营收同比35.6%；利润同比30.7% | 月涨幅分位29%；换手率4.70%；成交额17.8亿；价在MA20下方
2436,兴森科技,芯片智造,ABF载板、PCB,ABF载板龙头、封装基板核心、产能领先,29.79,131.79,无,52.0,42.8,70.8,50.63,基本面52.0 | 短线42.8 | 中期70.8 | ABF载板、PCB、龙头、产能领先、核心；缺少总市值数据，按中性处理；PE不可用或为负，估值可信度较低；毛利率19.2%，利润垫偏薄；ROE 0.3%偏低；营收同比15.1%；利润同比100.0% | 月涨幅分位57%；换手率8.47%；成交额57.7亿；价在MA20下方
688018,乐鑫科技,芯片智造,车规芯片,核心供应商、国产替代,4.32,-4.28,无,59.0,20.6,27.4,113.58,基本面59.0 | 短线20.6 | 中期27.4 | 车规芯片、国产替代、核心供应商、核心；缺少总市值数据，按中性处理；PE不可用或为负，估值可信度较低；毛利率48.5%，盈利能力优秀；ROE 3.0%偏低；营收同比16.2%；利润同比44.8% | 月涨幅分位14%；换手率4.39%；成交额11.9亿；价在MA20下方
603773,沃格光电,芯片智造,玻璃基板,光电玻璃龙头、技术壁垒高、产能领先、TGV龙头,71.51,361.7,无,43.0,47.2,70.9,115.14,基本面43.0 | 短线47.2 | 中期70.9 | 龙头、技术壁垒高、产能领先；缺少总市值数据，按中性处理；PE不可用或为负，估值可信度较低；毛利率16.7%，利润垫偏薄；ROE -4.7%偏低；营收同比8.5%；利润同比-112.1% | 月涨幅分位91%；换手率10.08%；成交额28.9亿；价在MA20下方
688409,富创精密,芯片智造,薄膜沉积,零部件核心、技术领先,53.02,342.14,无,57.0,54.0,86.9,292.5,基本面57.0 | 短线54.0 | 中期86.9 | 薄膜沉积、技术领先、核心；缺少总市值数据，按中性处理；PE不可用或为负，估值可信度较低；毛利率27.1%，处于一般水平；ROE 1.3%偏低；营收同比36.8%；利润同比361.5% | 月涨幅分位82%；换手率3.05%；成交额23.1亿；价在MA20上方
300458,全志科技,芯片智造,车规芯片,核心供应商、国产替代,8.72,7.57,无,65.0,29.2,70.5,42.4,基本面65.0 | 短线29.2 | 中期70.5 | 车规芯片、国产替代、核心供应商、核心；缺少总市值数据，按中性处理；PE不可用或为负，估值可信度较低；毛利率40.2%，盈利能力优秀；ROE 6.3%；营收同比47.1%；利润同比121.8% | 月涨幅分位21%；换手率5.95%；成交额17.9亿；价在MA20上方
2371,北方华创,芯片智造,刻蚀设备、韬定律、键合,行业核心、产能领先、国产替代,38.52,87.37,无,59.0,51.7,80.4,879.82,基本面59.0 | 短线51.7 | 中期80.4 | 刻蚀设备、产能领先、国产替代、核心；缺少总市值数据，按中性处理；PE不可用或为负，估值可信度较低；毛利率40.8%，盈利能力优秀；ROE 4.2%偏低；营收同比25.8%；利润同比3.4% | 月涨幅分位66%；换手率2.10%；成交额121.9亿；价在MA20上方
603005,晶方科技,芯片智造,传统封测,封测核心、技术突破、国产替代,37.46,77.81,无,53.0,37.4,58.2,42.93,基本面53.0 | 短线37.4 | 中期58.2 | 技术突破、国产替代、核心；缺少总市值数据，按中性处理；PE不可用或为负，估值可信度较低；毛利率47.4%，盈利能力优秀；ROE 1.4%偏低；营收同比14.9%；利润同比0.1% | 月涨幅分位65%；换手率9.93%；成交额27.7亿；价在MA20下方
688521,芯原股份,芯片智造,AI算力芯片,AI芯片IP核心、国产替代,10.38,164.29,无,54.0,46.8,69.4,289.81,基本面54.0 | 短线46.8 | 中期69.4 | AI算力芯片、国产替代、核心；缺少总市值数据，按中性处理；PE不可用或为负，估值可信度较低；毛利率32.3%，盈利能力良好；ROE -10.4%偏低；营收同比114.5%；利润同比-54.7% | 月涨幅分位23%；换手率4.05%；成交额63.5亿；价在MA20上方
300567,精测电子,芯片智造,刻蚀设备,检测核心、技术领先,58.93,224.18,无,56.0,56.7,82.7,292.28,基本面56.0 | 短线56.7 | 中期82.7 | 刻蚀设备、技术领先、核心；缺少总市值数据，按中性处理；PE不可用或为负，估值可信度较低；毛利率45.4%，盈利能力优秀；ROE 1.0%偏低；营收同比7.3%；利润同比13.6% | 月涨幅分位88%；换手率4.22%；成交额25.3亿；价在MA20上方
688802,沐曦股份,芯片智造,AI算力芯片,算力芯片核心、技术突破,-3.2,36.8,无,67.0,21.9,57.4,812.98,基本面67.0 | 短线21.9 | 中期57.4 | AI算力芯片、技术突破、核心；缺少总市值数据，按中性处理；PE不可用或为负，估值可信度较低；毛利率60.1%，盈利壁垒强；ROE -0.8%偏低；营收同比75.4%；利润同比57.5% | 月涨幅分位6%；换手率9.61%；成交额12.8亿；价在MA20下方
603650,彤程新材,芯片智造,光刻胶,KrF核心、技术领先,0.85,116.34,无,48.0,42.5,79.4,87.08,基本面48.0 | 短线42.5 | 中期79.4 | 光刻胶、技术领先、核心；缺少总市值数据，按中性处理；PE不可用或为负，估值可信度较低；毛利率22.2%，处于一般水平；ROE 4.3%偏低；营收同比22.5%；利润同比13.8% | 月涨幅分位10%；换手率5.83%；成交额30.7亿；价在MA20上方
